{
  "schemaVersion": "1.0",
  "artifactId": "discovery-member-details",
  "metadata": {
    "createdAt": "2026-09-11T03:26:18.121Z",
    "application": "Northstar Member Services",
    "baseUrl": "http://localhost:3000",
    "automation": "playwright",
    "model": "gemini-3.6-flash"
  },
  "goal": "Find member M-10482 and open the member details page.",
  "inputs": {
    "memberId": "M-10482"
  },
  "safety": {
    "allowedActions": [
      "click",
      "fill",
      "select",
      "wait",
      "finish",
      "escalate"
    ],
    "redaction": "credentials_and_sensitive_values",
    "maxSteps": 10,
    "llmAllowedDuringReplay": false
  },
  "steps": [
    {
      "index": 1,
      "action": "click",
      "target": "ME Mara Ellison M-10482 [REDACTED_EMAIL] Active",
      "value": null,
      "reason": "Click on member M-10482 (Mara Ellison) from the directory list to open the member details page.",
      "checkpoint": {
        "url": "http://localhost:3000/",
        "title": "Northstar Member Services",
        "accessibility": "- complementary:\n  - text: northstar. OPERATIONS CONSOLE\n  - strong: Member Services\n  - navigation \"Primary navigation\":\n    - button \"Member lookup\"\n    - button \"Member details\"\n    - button \"New account\"\n  - text: Local training environment No live member data\n  - button \"Sign out\"\n- main:\n  - text: Member Services Member details\n  - heading \"Mara Ellison\" [level=1]\n  - text: MO\n  - strong: Member Ops\n  - text: Signed in as [REDACTED_OPERATOR]\n  - button \"Back to lookup\"\n  - text: ME MEMBER RECORD / M-10482\n  - heading \"Mara Ellison\" [level=2]\n  - paragraph: Primary member | Joined Mar 12, 2019\n  - text: Active PHONE\n  - strong: [REDACTED_PHONE]\n  - text: EMAIL\n  - strong: [REDACTED_EMAIL]\n  - text: MEMBER ID\n  - strong: M-10482\n  - text: ACCOUNT PORTFOLIO\n  - heading \"Accounts & balances\" [level=3]\n  - button \"New account\"\n  - table:\n    - rowgroup:\n      - row \"ACCOUNT NAME ACCOUNT TYPE ACCOUNT NUMBER CURRENT BALANCE AVAILABLE Open\":\n        - columnheader \"ACCOUNT NAME\"\n        - columnheader \"ACCOUNT TYPE\"\n        - columnheader \"ACCOUNT NUMBER\"\n        - columnheader \"CURRENT BALANCE\"\n        - columnheader \"AVAILABLE\"\n        - columnheader \"Open\"\n    - rowgroup:\n      - row \"Everyday Checking Checking •••• 4821 $8,420.16 $8,120.16 Open Everyday Checking\":\n        - cell \"Everyday Checking\":\n          - strong: Everyday Checking\n        - cell \"Checking\"\n        - cell \"•••• 4821\"\n        - cell \"$8,420.16\":\n          - strong: $8,420.16\n        - cell \"$8,120.16\"\n        - cell \"Open Everyday Checking\":\n          - button \"Open Everyday Checking\"\n      - row \"Rainy Day Savings Savings •••• 1137 $14,805.42 $14,805.42 Open Rainy Day Savings\":\n        - cell \"Rainy Day Savings\":\n          - strong: Rainy Day Savings\n        - cell \"Savings\"\n        - cell \"•••• 1137\"\n        - cell \"$14,805.42\":\n          - strong: $14,805.42\n        - cell \"$14,805.42\"\n        - cell \"Open Rainy Day Savings\":\n          - button \"Open Rainy Day Savings\"\n      - row \"Travel Rewards Credit •••• 9004 $1,240.38 $8,759.62 Open Travel Rewards\":\n        - cell \"Travel Rewards\":\n          - strong: Travel Rewards\n        - cell \"Credit\"\n        - cell \"•••• 9004\"\n        - cell \"$1,240.38\":\n          - strong: $1,240.38\n        - cell \"$8,759.62\"\n        - cell \"Open Travel Rewards\":\n          - button \"Open Travel Rewards\"\n  - text: \"Core system status:\"\n  - strong: Connected\n  - text: \"Last refreshed: just now\""
      }
    }
  ],
  "result": {
    "status": "completed",
    "businessCode": null,
    "error": null,
    "finalCheckpoint": {
      "url": "http://localhost:3000/",
      "title": "Northstar Member Services",
      "accessibility": "- complementary:\n  - text: northstar. OPERATIONS CONSOLE\n  - strong: Member Services\n  - navigation \"Primary navigation\":\n    - button \"Member lookup\"\n    - button \"Member details\"\n    - button \"New account\"\n  - text: Local training environment No live member data\n  - button \"Sign out\"\n- main:\n  - text: Member Services Member details\n  - heading \"Mara Ellison\" [level=1]\n  - text: MO\n  - strong: Member Ops\n  - text: Signed in as [REDACTED_OPERATOR]\n  - button \"Back to lookup\"\n  - text: ME MEMBER RECORD / M-10482\n  - heading \"Mara Ellison\" [level=2]\n  - paragraph: Primary member | Joined Mar 12, 2019\n  - text: Active PHONE\n  - strong: [REDACTED_PHONE]\n  - text: EMAIL\n  - strong: [REDACTED_EMAIL]\n  - text: MEMBER ID\n  - strong: M-10482\n  - text: ACCOUNT PORTFOLIO\n  - heading \"Accounts & balances\" [level=3]\n  - button \"New account\"\n  - table:\n    - rowgroup:\n      - row \"ACCOUNT NAME ACCOUNT TYPE ACCOUNT NUMBER CURRENT BALANCE AVAILABLE Open\":\n        - columnheader \"ACCOUNT NAME\"\n        - columnheader \"ACCOUNT TYPE\"\n        - columnheader \"ACCOUNT NUMBER\"\n        - columnheader \"CURRENT BALANCE\"\n        - columnheader \"AVAILABLE\"\n        - columnheader \"Open\"\n    - rowgroup:\n      - row \"Everyday Checking Checking •••• 4821 $8,420.16 $8,120.16 Open Everyday Checking\":\n        - cell \"Everyday Checking\":\n          - strong: Everyday Checking\n        - cell \"Checking\"\n        - cell \"•••• 4821\"\n        - cell \"$8,420.16\":\n          - strong: $8,420.16\n        - cell \"$8,120.16\"\n        - cell \"Open Everyday Checking\":\n          - button \"Open Everyday Checking\"\n      - row \"Rainy Day Savings Savings •••• 1137 $14,805.42 $14,805.42 Open Rainy Day Savings\":\n        - cell \"Rainy Day Savings\":\n          - strong: Rainy Day Savings\n        - cell \"Savings\"\n        - cell \"•••• 1137\"\n        - cell \"$14,805.42\":\n          - strong: $14,805.42\n        - cell \"$14,805.42\"\n        - cell \"Open Rainy Day Savings\":\n          - button \"Open Rainy Day Savings\"\n      - row \"Travel Rewards Credit •••• 9004 $1,240.38 $8,759.62 Open Travel Rewards\":\n        - cell \"Travel Rewards\":\n          - strong: Travel Rewards\n        - cell \"Credit\"\n        - cell \"•••• 9004\"\n        - cell \"$1,240.38\":\n          - strong: $1,240.38\n        - cell \"$8,759.62\"\n        - cell \"Open Travel Rewards\":\n          - button \"Open Travel Rewards\"\n  - text: \"Core system status:\"\n  - strong: Connected\n  - text: \"Last refreshed: just now\""
    }
  }
}
